,page,date,title,action,pair
2232,782,2015-01-19,Forex GBP/USD edges higher but gains capped in quiet trade,bull,gbp/usd
2233,782,2015-01-19,Forex AUD/USD edges lower despite upbeat Australian data,bear,aud/usd
2234,783,2015-01-16,Forex EUR/USD hits fresh 11-year lows on ECB stimulus expectations,bear,eur/usd
2235,783,2015-01-16,Forex USD/CAD hovers near fresh 5-year highs despite weak U.S. data,bear,usd/cad
2236,783,2015-01-16,Forex GBP/USD edges higher but gains in check,bull,gbp/usd
2237,783,2015-01-15,Forex USD/CHF EUR/CHF plunge after shock SNB move,bear,eur/chf
2238,784,2015-01-15,Forex NZD/USD rises but upside seen limited,bull,nzd/usd
2239,784,2015-01-15,Forex AUD/USD climbs higher on strong Australian jobs data,bull,aud/usd
2240,784,2015-01-14,Forex EUR/USD hits fresh 9-year lows after ECJ ruling,bear,eur/usd
2241,784,2015-01-14,Forex NZD/USD slips lower in risk-off trade,bear,nzd/usd
2242,785,2015-01-13,Forex USD/CAD dips still near 5-1/2 year highs,bear,usd/cad
2243,785,2015-01-12,Forex Aussie gains on China trade data yen up on safe haven demand,bull,aud/jpy
2244,785,2015-01-12,Forex EUR/USD remains close to 9-year lows in subdued trade,bear,eur/usd
2245,785,2015-01-12,Forex GBP/USD slides to nearly 18-month lows in quiet trade,bear,gbp/usd
2246,786,2015-01-12,Forex Dollar dips against euro yen,bear,eur/jpy
2247,786,2015-01-09,Forex USD/CAD rises to fresh 5-year highs after U.S. Canadian data,bull,usd/cad
2248,786,2015-01-09,Forex EUR/USD holds steady near 9-year lows,bear,eur/usd
2249,787,2015-01-08,ForexAussie down ahead of retail sales yen weaker ahead of U.S. jobs ,bear,usd/jpy
2250,787,2015-01-08,Forex GBP/USD drops to 18-month lows ahead of BoE statement,bear,gbp/usd
2251,787,2015-01-08,Forex NZD/USD edges higher but gains seen limited,bull,nzd/usd
2252,787,2015-01-08,Forex AUD/USD rises off 5-1/2 year highs on Australian data,bull,aud/usd
2253,787,2015-01-07,Forex Aussie gains ahead of likely China trade data yen steady,bull,aud/jpy
2254,788,2015-01-07,Forex GBP/USD edges down to fresh 17-month lows,bear,gbp/usd
2255,788,2015-01-07,Forex AUD/USD slips hovers near more than 5-year lows,bear,aud/usd
2256,788,2015-01-06,Forex EUR/GBP edges higher but upside seen limited,bull,eur/gbp
2257,788,2015-01-06,Dollar slips vs. firmer yen euro struggles near 9-year lows ,bear,eur/jpy
2258,788,2015-01-06,Forex GBP/USD falls to fresh 17-month lows on weak U.K. data,bear,gbp/usd
2259,788,2015-01-06,Forex NZD/USD moves higher but gains seen limited,bull,nzd/usd
2260,788,2015-01-06,Forex Euro struggles near 9-year lows yen higher,bear,eur/jpy
2261,789,2015-01-05,Forex Australian dollar gains ahead of trade data yen up early,bull,aud/jpy
2262,789,2015-01-05,Forex GBP/USD hits fresh 17-month lows on U.K. construction data,bear,gbp/usd
2263,789,2015-01-05,Forex AUD/USD drops to 5-1/2 year lows,bear,aud/usd
2264,790,2015-01-02,Forex USD/JPY climbs higher ISM report on tap,bull,usd/jpy
2265,790,2015-01-02,Forex GBP/USD approaches 17-month lows as U.K. PMI disappoints,bear,gbp/usd
2266,790,2015-01-02,Forex EUR/USD drops to 4-1/2 year lows ahead of E.Z. data,bear,eur/usd
2267,790,2014-12-30,Forex USD/JPY drops on year-end profit-taking,bear,usd/jpy
2268,790,2014-12-30,Forex GBP/USD edges higher but upside seen limited,bull,gbp/usd
2269,790,2014-12-30,Forex EUR/USD falls to fresh 2-year lows in quiet trade,bear,eur/usd
2270,791,2014-12-29,Forex EUR/USD remains moderately higher amid Greece jitters,bull,eur/usd
2271,791,2014-12-29,Forex GBP/USD edges higher but gains seen limited,bull,gbp/usd
2272,791,2014-12-29,Forex EUR/USD holds steady near 2-year lows Greece in focus,bear,eur/usd
2273,791,2014-12-23,Forex EUR/USD drops to fresh 2-year lows on strong U.S. data,bear,eur/usd
2274,791,2014-12-23,Forex GBP/USD falls to fresh 15-month lows after U.K. data,bear,gbp/usd
2275,791,2014-12-23,Forex EUR/USD almost unchanged near 2-year lows,bear,eur/usd
2276,792,2014-12-22,Forex EUR/USD holds moderate gains after E.Z. U.S. data,bull,eur/usd
2277,792,2014-12-22,Forex USD/CAD edges higher re-approaches 5-year peak,bull,usd/cad
2278,792,2014-12-22,Forex USD/JPY rises to 1-week highs in light trade,bull,usd/jpy
2279,792,2014-12-22,Forex EUR/USD rises off 2-year lows but gains capped,bull,eur/usd
2280,792,2014-12-19,Forex GBP/USD slides as markets prep for U.S. rate hikes in 2015,bear,gbp/usd
2281,792,2014-12-19,Forex EUR/USD slides in quiet trading with Fed still in focus,bear,eur/usd
2282,792,2014-12-19,Forex EUR/USD little changed near 2-year lows in subdued trade,bear,eur/usd
2283,792,2014-12-19,Forex USD/CAD trims gains after Canadian CPI retail sales data,bull,usd/cad
2284,793,2014-12-19,Forex USD/JPY continues to rise after BoJ maintains easing,bull,usd/jpy
2285,793,2014-12-18,Forex GBP/USD gains on upbeat U.K. retail sales figures,bull,gbp/usd
2286,793,2014-12-18,Forex GBP/USD rises on strong U.K. retail sales data,bull,gbp/usd
2287,793,2014-12-18,Forex NZD/USD rises on upbeat N.Z. GDP report,bull,nzd/usd
2288,793,2014-12-18,Forex Dollar higher against euro yen after Fed,bull,eur/jpy
2289,794,2014-12-17,Forex GBP/USD dips as markets preps for upbeat Fed statement,bear,gbp/usd
2290,794,2014-12-17,Forex EUR/USD slides lower after E.Z. inflation report,bear,eur/usd
2291,794,2014-12-17,Forex NZD/USD drops after N.Z. data eyes on Fed,bear,nzd/usd
2292,795,2014-12-16,Forex GBP/USD gains on soft U.S. housing reports,bull,gbp/usd
2293,795,2014-12-16,Forex USD/CAD slides lower after U.S. housing data disappoints,bear,usd/cad
2294,795,2014-12-16,Forex Euro trims gains yen rallies,bull,eur/jpy
2295,795,2014-12-16,Forex EUR/USD pushes higher on strong ZEW report,bull,eur/usd
2296,795,2014-12-16,Forex NZD/USD edges higher but gains seen limited,bull,nzd/usd
2297,795,2014-12-15,Forex GBP/USD dips on upbeat U.S. industrial output report,bear,gbp/usd
2298,795,2014-12-15,Forex EUR/USD slides on brewing Greek political instability,bear,eur/usd
2299,796,2014-12-15,Forex USD/JPY remains moderately lower in risk-off trade,bear,usd/jpy
2300,796,2014-12-15,Forex Euro slides lower vs. dollar yen amid Greece election jitters,bear,eur/jpy
2301,796,2014-12-15,Forex NZD/USD falls in risk-off trade,bear,nzd/usd
2302,796,2014-12-15,Forex AUD/USD hits fresh 4-year lows after Australian outlook report,bear,aud/usd
2303,797,2014-12-12,Forex EUR/USD gains on mixed U.S. sentiment pricing data,bull,eur/usd
2304,797,2014-12-12,Forex GBP/USD dips on lackluster U.K. construction data,bear,gbp/usd
2305,797,2014-12-12,Forex EUR/USD remains higher UoM report caps gains,bull,eur/usd
2306,797,2014-12-12,Forex EUR/USD rises after euro zone industrial production data,bull,eur/usd
2307,797,2014-12-12,Forex GBP/USD edges lower after weak U.K. construction data,bear,gbp/usd
2308,797,2014-12-12,Forex USD/JPY edges higher as U.S. data still supports,bull,usd/jpy
2309,797,2014-12-11,Forex EUR/USD dips as dollar advances on upbeat U.S. retail sales ,bear,eur/usd
2310,798,2014-12-11,Forex EUR/CHF closes in on 26-month lows after SNB holds,bear,eur/chf
2311,798,2014-12-11,Forex NZD/USD trims gains after RBNZ holds rates,bull,nzd/usd
2312,798,2014-12-10,Forex USD/JPY drops as yen gains on Chinese growth concerns,bull,usd/jpy
2313,798,2014-12-10,Forex EUR/USD gains as dollar cools rally tracks firming yen,bull,eur/usd
2314,798,2014-12-10,Forex USD/CAD edges higher in early trade,bull,usd/cad
2315,799,2014-12-10,Forex NZD/USD higher but gains seen limited,bull,nzd/usd
2316,799,2014-12-10,Forex AUD/USD rises after mixed Australian reports,bull,aud/usd
2317,799,2014-12-09,Forex USD/JPY pushes lower tumbles over 1,bear,usd/jpy
2318,799,2014-12-09,Forex EUR/USD rises after upbeat German trade data,bull,eur/usd
2319,799,2014-12-09,Forex GBP/USD steady near 15-month lows after U.K. data,bear,gbp/usd
2320,799,2014-12-09,Forex NZD/USD holds steady near 2-/12 year lows,bear,nzd/usd
2321,799,2014-12-09,Forex AUD/USD hits fresh 4-1/2 year lows Australian data disappoints,bear,aud/usd
2322,800,2014-12-08,Forex AUD/USD drops to 4-1/2 year lows despite Australian data,bear,aud/usd
2323,801,2014-12-05,Forex EUR/USD drops as dollar firms on upbeat U.S. jobs report,bear,eur/usd
2324,801,2014-12-05,Forex EUR/USD drops to fresh 2-year lows after U.S. data,bear,eur/usd
2325,801,2014-12-05,Forex USD/CAD rises after U.S. Canadian employment data,bull,usd/cad
2326,802,2014-12-04,Forex GBP/USD dips as BoE holds on rates stimulus,bear,gbp/usd
2327,802,2014-12-04,Forex AUD/USD hits fresh 4-year lows despite Australian data,bear,aud/usd
2328,802,2014-12-03,Forex Aussie gains on solid retail sales trade data yen down a tad,bull,aud/jpy
2329,802,2014-12-03,Forex Aussie weaker ahead of retail trade data sets yen steady,bear,aud/jpy
2330,802,2014-12-03,Forex GBP/USD gains on upbeat U.K. service-sector report,bull,gbp/usd
2331,803,2014-12-03,Forex EUR/USD drops on upbeat U.S. service-sector report,bear,eur/usd
2332,803,2014-12-03,Forex USD/CAD hits session lows after BoC rate statement,bear,usd/cad
2333,803,2014-12-03,Forex AUD/USD hits fresh 4-year lows on Australian GDP data,bear,aud/usd
2334,803,2014-12-02,Forex GBP/USD drops as dollar rallies on U.S. construction data,bear,gbp/usd
2335,803,2014-12-02,Forex EUR/USD drops ahead of ECB meeting,bear,eur/usd
2336,803,2014-12-02,Forex EUR/USD pushes lower eyes on ECB meeting,bear,eur/usd
2337,804,2014-12-02,Forex USD/CAD rises in early trade,bull,usd/cad
2338,804,2014-12-02,Forex EUR/USD falls in cautious trade ahead of ECB meeting,bear,eur/usd
2339,804,2014-12-02,Forex GBP/USD slips lower as U.K. construction data disappoints,bear,gbp/usd
2340,804,2014-12-02,Forex AUD/USD rises after RBA holds rates,bull,aud/usd
2341,804,2014-12-01,Forex USD/JPY slides on lukewarm U.S. factory reports,bear,usd/jpy
2342,804,2014-12-01,Forex EUR/USD gains on tepid U.S. factory data,bull,eur/usd
2343,804,2014-12-01,Forex Euro holds gains vs. dollar after U.S. factory data,bull,eur/usd
2344,805,2014-12-01,Forex USD/CAD slides lower in early trade,bear,usd/cad
2345,805,2014-12-01,Forex EUR/GBP drops after E.Z. U.K. PMI reports,bear,eur/gbp
2346,805,2014-12-01,Forex GBP/USD rises on upbeat U.K. manufacturing data,bull,gbp/usd
2347,805,2014-12-01,Forex AUD/USD falls to 4-year lows despite Australian data,bear,aud/usd
2348,805,2014-11-30,Forex Yen Aussie weaker ahead of China PMI data,bear,aud/jpy
2349,806,2014-11-28,Forex USD/CAD rises to 3-week highs despite Canadian GDP data,bull,usd/cad
2350,806,2014-11-28,Forex EUR/USD edges higher but upside seen limited,bull,eur/usd
2351,806,2014-11-28,Forex GBP/USD slips lower after U.K. house price data,bear,gbp/usd
2352,806,2014-11-28,Forex USD/JPY rises after Japanese economic reports,bull,usd/jpy
2353,806,2014-11-27,Forex USD/CAD edges slightly higher in early trade,bull,usd/cad
2354,806,2014-11-27,Forex GBP/USD slips lower in quiet trade,bear,gbp/usd
2355,806,2014-11-27,Forex AUD/USD higher after positive Australian data,bull,aud/usd
2356,807,2014-11-27,Forex AUD/USD higher after positive Australian data,bull,aud/usd
2357,807,2014-11-27,Forex Dollar slips lower against euro yen ,bear,eur/jpy
2358,807,2014-11-26,Forex Kiwi gains after trade data with deals thin on U.S. holiday,bull,nzd/usd
2359,807,2014-11-26,Forex USD/JPY slides mixed bag of U.S. economic indicators,bear,usd/jpy
2360,807,2014-11-26,Forex EUR/USD gains on tepid bag of U.S. data,bull,eur/usd
2361,807,2014-11-26,Forex EUR/USD at session highs after string of weak U.S. data,bear,eur/usd
2362,807,2014-11-26,Forex USD/CAD erases gains after U.S. data,bull,usd/cad
2363,807,2014-11-26,Forex GBP/USD slips lower after U.K. GDP report,bear,gbp/usd
2364,808,2014-11-26,Forex Dollar lower against yen euro steady ,bear,eur/jpy
2365,808,2014-11-25,Forex Yen gains in early Asia with focus on busy U.S. data day ahead,bull,usd/jpy
2366,808,2014-11-25,Forex EUR/USD up as weak consumer confidence data spark dollar selloff,bear,eur/usd
2367,808,2014-11-25,Forex USD/JPY slides on U.S. confidence data BoJ minutes,bear,usd/jpy
2368,808,2014-11-25,Forex EUR/USD touches session highs gains checked,bull,eur/usd
2369,808,2014-11-25,Forex USD/CAD edges lower after Canadian U.S. data,bear,usd/cad
2370,808,2014-11-25,Forex EUR/USD slips lower despite positive German data,bear,eur/usd
2371,808,2014-11-25,Forex NZD/USD drops on N.Z. inflation expectations,bear,nzd/usd
2372,809,2014-11-24,Forex GBP/USD gains as dollar cools rally ahead of U.S. GDP report,bull,gbp/usd
2373,809,2014-11-24,Forex EUR/USD gains on upbeat German business climate report,bull,eur/usd
2374,809,2014-11-24,Forex USD/CAD edges higher in early trade,bull,usd/cad
2375,809,2014-11-24,Dollar pushes higher vs. yen Ifo data supports euro ,bull,eur/jpy
2376,809,2014-11-24,Forex NZD/USD edges higher but gains seen limited,bull,nzd/usd
2377,810,2014-11-21,Forex EUR/USD drops to session lows on dovish Draghi comments,bear,eur/usd
2378,810,2014-11-21,Forex EUR/USD remains lower on ECB easing expectations,bear,eur/usd
2379,810,2014-11-21,Forex USD/CAD falls to 3-week lows after upbeat Canadian CPI,bear,usd/cad
2380,810,2014-11-21,Forex EUR/USD drops near 27-month lows on Draghi remarks,bear,eur/usd
2381,810,2014-11-21,Forex GBP/USD slides lower after U.K. public borrowing data,bear,gbp/usd
2382,810,2014-11-21,Forex USD/JPY slips on profit-taking still near 7-year peak,bear,usd/jpy
2383,811,2014-11-20,Forex EUR/USD dips as dollar firms on soaring Philly factory gauge,bear,eur/usd
2384,811,2014-11-20,Forex Euro slightly lower against dollar after U.S. data,bear,eur/usd
2385,811,2014-11-20,Forex USD/CAD slips lower in early U.S. trade,bear,usd/cad
2386,811,2014-11-20,Dollar hits fresh 7-year highs vs. yen euro slips,bear,eur/jpy
2387,811,2014-11-20,Forex AUD/USD slides lower after Fed minutes,bear,aud/usd
2388,811,2014-11-20,Forex Yen falls to fresh multi-year lows against dollar euro,bear,eur/jpy
2389,812,2014-11-19,Forex USD/JPY gains ahead of Fed minutes,bull,usd/jpy
2390,812,2014-11-19,Forex USD/CAD slips after mixed U.S. housing data Fed ahead,bear,usd/cad
2391,812,2014-11-19,Forex GBP/USD barely off 14-month lows after BoE minutes,bear,gbp/usd
2392,812,2014-11-19,Forex NZD/USD slides lower in risk-off trade,bear,nzd/usd
2393,812,2014-11-19,Forex AUD/USD drops as Japan news dominate,bear,aud/usd
2394,812,2014-11-18,Forex USD/JPY gains as Japan calls for early elections,bull,usd/jpy
2395,812,2014-11-18,Forex EUR/USD gains on upbeat German sentiment data,bull,eur/usd
2396,813,2014-11-18,Dollar hits 7-year highs vs. yen euro pushes higher,bull,eur/jpy
2397,813,2014-11-18,Forex EUR/USD extends gains on strong ZEW data,bull,eur/usd
2398,813,2014-11-18,Forex GBP/USD edges higher after U.K. inflation data,bull,gbp/usd
2399,813,2014-11-18,Forex NZD/USD higher but upside seen limited,bull,nzd/usd
2400,813,2014-11-18,Forex AUD/USD rises after RBA meeting minutes,bull,aud/usd
2401,813,2014-11-17,Forex USD/CAD rises in risk-off trade,bull,usd/cad
2402,814,2014-11-17,Forex GBP/USD slips near 14-month lows,bear,gbp/usd
2403,814,2014-11-17,Forex Euro lower against dollar yen as Japan data hits sentiment,bear,eur/jpy
2404,815,2014-11-14,Forex USD/JPY gains on upbeat U.S. retail sales sentiment data,bull,usd/jpy
2405,815,2014-11-14,Forex USD/CAD edges lower after U.S. Canadian data,bear,usd/cad
2406,815,2014-11-14,Forex GBP/USD close to 14-month lows after U.K. data,bear,gbp/usd
2407,815,2014-11-14,Forex EUR/USD slides lower GDP data in focus,bear,eur/usd
2408,815,2014-11-13,Forex USD/JPY gains on talk of snap election in Japan,bull,usd/jpy
2409,815,2014-11-13,Forex EUR/USD gains on lukewarm U.S. jobless claims report,bull,eur/usd
2410,816,2014-11-13,Forex Aussie dollar and yen weaker after China data disappoints,bear,aud/jpy
2411,816,2014-11-12,Forex Yen slightly weaker on downbeat data Aussie up ahead of China,bear,aud/jpy
2412,816,2014-11-12,Forex GBP/USD dips after BoE trims inflation forecasts,bear,gbp/usd
2413,816,2014-11-12,Forex EUR/USD dips on soft industrial output data,bear,eur/usd
2414,816,2014-11-12,Forex USD/CAD lower ahead of Canada’s budget update,bear,usd/cad
2415,816,2014-11-12,Dollar rises vs. pound slides lower against yen,bear,gbp/jpy
2416,817,2014-11-12,Dollar rises vs. pound slides lower against yen,bear,gbp/jpy
2417,817,2014-11-12,Forex EUR/USD slips lower as E.Z. industrial production disappoints,bear,eur/usd
2418,817,2014-11-12,Forex AUD/USD edges higher on upbeat Australian data,bull,aud/usd
2419,817,2014-11-12,Forex NZD/USD rises after RBNZ comments,bull,nzd/usd
2420,817,2014-11-11,Forex EUR/USD gains on demand from bargain hunters,bull,eur/usd
2421,817,2014-11-11,Forex USD/JPY gains on talk of snap election in Japan,bull,usd/jpy
2422,818,2014-11-11,Forex AUD/USD edges lower business confidence data weighs,bear,aud/usd
2423,818,2014-11-10,Forex GBP/USD dips as investors shrug off soft U.S. jobs report,bear,gbp/usd
2424,818,2014-11-10,Forex EUR/USD dips as dollar shrugs off jobs report regains ground,bear,eur/usd
2425,818,2014-11-10,Forex USD/CAD falls to 1-week low in early trade,bear,usd/cad
2426,819,2014-11-10,Forex NZD/USD higher amid profit-taking,bull,nzd/usd
2427,820,2014-11-07,Forex GBP/USD gains on soft U.S. October jobs report,bull,gbp/usd
2428,820,2014-11-07,Forex EUR/USD gains on lackluster October jobs report,bull,eur/usd
2429,820,2014-11-07,Forex USD/CAD declines after U.S. Canadian jobs data,bear,usd/cad
2430,820,2014-11-07,Forex GBP/USD slips to fresh 14-month lows after U.K. trade report,bear,gbp/usd
2431,820,2014-11-06,Forex GBP/USD drops as BoE holds on interest rates,bear,gbp/usd
2432,820,2014-11-06,Forex EUR/USD drops to 2-year lows on dovish Draghi comments,bear,eur/usd
2433,821,2014-11-06,Forex AUD/USD eases after falling to 4-year lows,bear,aud/usd
2434,821,2014-11-05,Forex USD/JPY gains on upbeat U.S. private-sector jobs data,bull,usd/jpy
2435,821,2014-11-05,Forex EUR/USD slides as dollar firms on private-sector jobs report,bear,eur/usd
2436,822,2014-11-05,Forex Euro touches 2-year lows against Swiss franc,bear,eur/chf
2437,822,2014-11-05,Forex Australian dollar lower against firmer U.S. dollar,bear,aud/usd
2438,822,2014-11-04,Forex USD/JPY falls as dollar rally cools bargain hunting boosts yen,bear,usd/jpy
2439,822,2014-11-04,Forex EUR/USD gains as dollar rally takes a breather,bull,eur/usd
2440,823,2014-11-04,Forex NZD/USD edges higher but gains capped N.Z. data ahead,bull,nzd/usd
2441,823,2014-11-03,Forex Yen gains in early Asia Aussie up ahead of central bank review,bull,aud/jpy
2442,823,2014-11-03,Forex USD/JPY extends gains on new Japan stimulus measures,bull,usd/jpy
2443,823,2014-11-03,Forex EUR/USD remains lower after upbeat ISM report,bear,eur/usd
2444,823,2014-11-03,Forex USD/CAD edges higher ahead of ISM data,bull,usd/cad
2445,823,2014-11-03,Forex EUR/USD slips to more than 2-year lows after E.Z. data,bear,eur/usd
2446,824,2014-10-31,Forex EUR/USD slides on U.S. data surprise BoJ stimulus,bear,eur/usd
2447,824,2014-10-31,Forex EUR/USD hits 26-month trough after strong U.S. data,bull,eur/usd
2448,824,2014-10-31,Forex USD/CAD climbs higher as Canada GDP disappoints,bull,usd/cad
2449,825,2014-10-30,Forex USD/JPY gains on U.S. growth data end of Fed stimulus,bull,usd/jpy
2450,825,2014-10-30,Forex AUD/USD slides lower on hawkish Fed statement,bear,aud/usd
2451,825,2014-10-30,Forex NZD/USD near 4-week lows after RBNZ Fed statements,bear,nzd/usd
2452,826,2014-10-29,Forex USD/CAD falls to 3-week lows in early trade,bear,usd/cad
2453,826,2014-10-29,Forex AUD/USD higher with Fed meeting in focus,bull,aud/usd
2454,826,2014-10-29,Forex NZD/USD rises on upbeat N.Z. data RBNZ statement ahead,bull,nzd/usd
2455,826,2014-10-28,Forex GBP/USD gains on soft U.S. durable goods report,bull,gbp/usd
2456,826,2014-10-28,Forex EUR/USD gains on soft U.S. durable goods report,bull,eur/usd
2457,826,2014-10-28,Forex USD/CAD slips lower on downbeat U.S. data,bear,usd/cad
2458,827,2014-10-28,Forex USD/CAD slips lower on downbeat U.S. data,bear,usd/cad
2459,827,2014-10-28,Forex USD/JPY edges higher Fed statement in focus,bull,usd/jpy
2460,827,2014-10-28,Forex NZD/USD edges higher FOMC statement in focus,bull,nzd/usd
2461,827,2014-10-28,Forex AUD/USD rises to 2-week highs ahead of Fed,bull,aud/usd
2462,827,2014-10-27,Forex GBP/USD gains on soft U.S. home sales report,bull,gbp/usd
2463,827,2014-10-27,Forex EUR/USD gains on soft U.S. home sales European stress tests,bull,eur/usd
2464,827,2014-10-27,Dollar lower vs. yen euro slips after German Ifo,bear,eur/jpy
2465,828,2014-10-24,Forex GBP/USD gains on soft U.K. housing data firm U.K. GDP report,bull,gbp/usd
2466,828,2014-10-24,Forex EUR/USD gains on disappointing U.S. home sales data,bull,eur/usd
2467,828,2014-10-24,Forex EUR/USD extends gains after U.S. data disappoints,bull,eur/usd
2468,829,2014-10-24,Forex EUR/USD extends gains after U.S. data disappoints,bull,eur/usd
2469,829,2014-10-24,Forex USD/CAD falls in early trade U.S. data ahead,bear,usd/cad
2470,829,2014-10-24,Forex GBP/USD edges higher after U.K. GDP report,bull,gbp/usd
2471,829,2014-10-24,Forex EUR/USD edges higher on upbeat Gfk report,bull,eur/usd
2472,829,2014-10-23,Forex Dollar falls against yen in early Asia Aussie down,bear,aud/jpy
2473,829,2014-10-23,Forex EUR/USD trims gains on upbeat U.S. data earnings,bull,eur/usd
2474,829,2014-10-23,Dollar rallies against yen euro erases gains,bull,eur/jpy
2475,829,2014-10-23, Forex US dollar edges higher against Canadian dollar,bull,usd/cad
2476,829,2014-10-23,Forex GBP/USD slides lower after U.K. retail sales disappoint,bear,gbp/usd
2477,830,2014-10-23,Forex NZD/USD drops over 1 on soft N.Z. inflation data,bear,nzd/usd
2478,830,2014-10-22,Forex GBP/USD slips on U.S. inflation data Bank of England minutes,bear,gbp/usd
2479,830,2014-10-22,Forex GBP/USD pushes lower after BoE meeting minutes,bear,gbp/usd
2480,830,2014-10-22,Forex NZD/USD rises but upside seen limited,bull,nzd/usd
2481,830,2014-10-22,Forex AUD/USD edges higher after Australian inflation data,bull,aud/usd
2482,831,2014-10-21,Forex EUR/USD drops on talk of fresh ECB stimulus measures,bear,eur/usd
2483,831,2014-10-21, Forex Euro hits session lows against dollar yen,bear,eur/jpy
2484,831,2014-10-21,Dollar gains against euro yen remains higher,bull,eur/jpy
2485,831,2014-10-21,Forex AUD/USD higher after RBA minutes Chinese data,bull,aud/usd
2486,832,2014-10-20,Forex EUR/USD gains as investors readjust Fed rate hike forecasts,bull,eur/usd
2487,832,2014-10-20,Forex Euro edges higher vs. dollar yen in quiet trade,bull,eur/jpy
2488,832,2014-10-20,Forex Euro little changed vs. dollar gains against yen,bull,eur/jpy
2489,832,2014-10-20,Forex NZD/USD rises but upside seen limited,bull,nzd/usd
2490,832,2014-10-20,Forex AUD/USD edges higher gains capped by U.S. data ,bull,aud/usd
2491,832,2014-10-19,Forex Yen weaker ahead of Kuroda remarks Aussie awaits Kent,bear,aud/jpy
2492,833,2014-10-17,Forex USD/CAD dips on firm Canadian inflation figures,bear,usd/cad
2493,833,2014-10-17,Forex EUR/USD falls on upbeat U.S sentiment data,bear,eur/usd
2494,833,2014-10-17,Forex EUR/USD erases gains as UoM report beats expectations,bull,eur/usd
2495,833,2014-10-17,Forex USD/CAD edges lower after U.S. Canadian reports,bear,usd/cad
2496,833,2014-10-17,Forex EUR/USD edges higher U.S. data ahead,bull,eur/usd
2497,833,2014-10-17,Forex EUR/USD steady near 3-week high as sentiment improves,bull,eur/usd
2498,834,2014-10-16,Forex USD/JPY gains on solid U.S. jobless claims report,bull,usd/jpy
2499,834,2014-10-16,Forex EUR/USD falls as dollar applauds upbeat U.S. data,bear,eur/usd
2500,834,2014-10-16,Forex USD/CAD rises near 5-year highs as U.S. data supports,bull,usd/cad
2501,834,2014-10-16,Forex EUR/USD pushes lower as market sentiment wanes,bear,eur/usd
2502,834,2014-10-16,Forex GBP/USD almost unchanged near 11-month lows,bear,gbp/usd
2503,834,2014-10-15,Forex GBP/USD gains on soft U.S. retail wholesale pricing data,bull,gbp/usd
2504,834,2014-10-15,Forex EUR/USD shoots up as dollar slumps on disappointing U.S. data,bear,eur/usd
2505,835,2014-10-15,Forex USD/JPY edges lower after Amari comments,bear,usd/jpy
2506,835,2014-10-15,Forex EUR/USD edges lower Draghi speeches ahead,bear,eur/usd
2507,835,2014-10-14,Forex Yen weaker Aussie flat ahead of Westpac-MI China price data,bear,aud/jpy
2508,835,2014-10-14,Dollar posts solid gains on soft U.K. euro zone data,bull,eur/gbp
2509,835,2014-10-14,Forex GBP/USD drops on soft U.K. inflation data,bear,gbp/usd
2510,835,2014-10-14,Forex EUR/USD drops on downbeat euro area data,bear,eur/usd
2511,835,2014-10-14,Forex USD/CAD trims gains but remains supported in early trade,bull,usd/cad
2512,836,2014-10-14,Forex EUR/USD hits session lows on downbeat E.Z. data,bear,eur/usd
2513,836,2014-10-14,Forex GBP/USD extends losses on weak U.K. inflation report,bear,gbp/usd
2514,836,2014-10-14,Dollar recovers from Fed disappointment regains ground vs. yen euro,bear,eur/jpy
2515,836,2014-10-13,Forex Aussie dollar weaker after Debelle remarks yen also eases,bear,aud/jpy
2516,836,2014-10-13,Forex Japanese yen Aussie weaker in early Asian trade,bear,aud/jpy
2517,836,2014-10-13,Forex USD/JPY slides on dovish Fed comments,bear,usd/jpy
2518,836,2014-10-13,Forex EUR/USD gains on dovish Fed comments,bull,eur/usd
2519,836,2014-10-13,Forex EUR/USD remains higher in thin trade,bull,eur/usd
2520,836,2014-10-13,Forex EUR/USD holds gains in subdued trade,bull,eur/usd
2521,837,2014-10-13,Forex GBP/USD edges higher in quiet trade,bull,gbp/usd
2522,837,2014-10-13,Forex EUR/USD higher but gains seen limited,bull,eur/usd
2523,837,2014-10-12,Forex Australian dollar jumps on China data yen gains further,bull,aud/jpy
2524,837,2014-10-10,Forex USD/CAD dips on upbeat Canadian jobs report,bear,usd/cad
