,page,date,title,action,pair
811,372,2017-04-28,CFTC Speculators Less Bearish on Yen Sterling Gold Net Longs at 5-Month High,bull,gbp/jpy
812,373,2017-04-27,Euro dips against U.S. dollar on dovish ECB tone,bear,eur/usd
813,373,2017-04-27,Forex USD/CAD trims losses amid tumbling oil prices,bear,usd/cad
814,373,2017-04-27,Forex Aussie kiwi move higher vs. greenback after Trump comments,bull,aud/nzd
815,374,2017-04-26,Forex USD/CAD trims gains after mixed Canadian data,bull,usd/cad
816,374,2017-04-26,Forex Yen continues slide euro steady near 5-month highs,bear,eur/jpy
817,374,2017-04-26,Forex Aussie kiwi decline as Australian inflation data disappoints,bear,aud/nzd
818,374,2017-04-25,Forex Euro hits fresh 5-month highs yen sinks,bear,eur/jpy
819,374,2017-04-25,Forex Euro holding below 5-month highs yen weaker,bear,eur/jpy
820,375,2017-04-25,Forex Euro holds gains after French election rally yen weakens,bull,eur/jpy
821,375,2017-04-25,Euro flat vs. dollar loonie falls on U.S. duties   ,bear,eur/usd
822,375,2017-04-24,Euro surges yen dives as French election fears abate,bear,eur/jpy
823,376,2017-04-21,Forex USD/CAD edges higher after Canadian inflation data disappoints,bull,usd/cad
824,377,2017-04-20,Forex Kiwi Aussie rise after upbeat N.Z. inflation data,bull,aud/nzd
825,377,2017-04-19,Forex Yen weaker in Asia as trade Aso noted European polls eyed,bear,eur/jpy
826,377,2017-04-19,Forex USD/CAD rises to 2-week highs despite geopolitical concerns,bull,usd/cad
827,378,2017-04-19,Forex Aussie kiwi move lower as greenback mildly recovers,bear,aud/nzd
828,378,2017-04-17,Forex Dollar gains on yen in early Asia with US VP Pence in Tokyo,bull,usd/jpy
829,379,2017-04-14,CFTC Speculators More Bearish on Sterling Euro Gold Net Longs at 5-Month High,bull,eur/gbp
830,380,2017-04-12,Forex USD/CAD falls to 2-week lows after BoC holds,bear,usd/cad
831,381,2017-04-12,Forex Aussie steady kiwi lower amid global geopolitical tensions,bear,aud/nzd
832,381,2017-04-10,Forex Yen holds gains agains dollar in Asia Aussie up after NAB,bull,aud/jpy
833,382,2017-04-07,Forex USD/CAD drops after U.S. Canadian jobs data,bear,usd/cad
834,382,2017-04-07,Forex GBP/USD falls after U.K. data disappoints,bear,gbp/usd
835,382,2017-04-07,Dollar dips after U.S. air strikes against Syria yen firms   ,bear,usd/jpy
836,383,2017-04-05,Forex Dollar trims gains vs. yen after mixed U.S. data,bull,usd/jpy
837,384,2017-04-04,Forex Canadian dollar at 3-week lows after U.S. Canadian trade data,bear,usd/cad
838,384,2017-04-04,Forex Dollar hits 1-week lows vs. yen Aussie down after RBA,bear,aud/jpy
839,385,2017-04-02,Forex Yen gains ahead of Tankan Aussie data in focus,bull,aud/jpy
840,386,2017-03-31,Forex GBP/USD edges lower after mixed U.K. data,bear,gbp/usd
841,387,2017-03-30,Forex USD/CAD edges lower as oil prices climb,bear,usd/cad
842,387,2017-03-30,Forex Euro falls to day’s lows after German U.S. data,bear,eur/usd
843,387,2017-03-30,Forex Aussie kiwi slip lower vs. stronger greenback,bear,aud/nzd
844,387,2017-03-29,Dollar trades at highs sterling and euro sink ,bear,eur/gbp
845,388,2017-03-29,Forex Aussie almost unchanged kiwi moves lower vs. stronger greenback,bear,aud/nzd
846,390,2017-03-24,Forex USD/CAD trims gains healthcare bill on tap,bull,usd/cad
847,390,2017-03-24,Forex EUR/USD erases losses on strong E.Z. PMI reports,bull,eur/usd
848,391,2017-03-23,Forex USD/CAD pares gains after U.S. data,bull,usd/cad
849,391,2017-03-23,Forex Aussie slips lower kiwi edges higher as RBNZ holds,bear,aud/nzd
850,392,2017-03-22,Forex USD/CAD trims gains pulls back from 1-week highs,bull,usd/cad
851,392,2017-03-22,Forex Aussie slips lower kiwi holds steady vs. greenback,bear,aud/nzd
852,392,2017-03-21,Dollar slumps sterling and euro hit highs,bear,eur/gbp
853,394,2017-03-17,CFTC Speculators More Bearish on Sterling Yen S&P 500 Longs at 6-Month High,bull,gbp/jpy
854,394,2017-03-17,Forex USD/CAD pares gains after upbeat Canadian data,bull,usd/cad
855,394,2017-03-16,Forex Yen holds weaker in Asia U.S. consumer survey ahead,bear,usd/jpy
856,394,2017-03-16,Forex Dollar gains slightly against yen in Asia U.S. data eyed,bull,usd/jpy
857,395,2017-03-16,Forex USD/CAD almost unchanged near 2-week lows,bear,usd/cad
858,395,2017-03-16,Forex Aussie kiwi move lower vs. greenback in late trade,bear,aud/nzd
859,395,2017-03-15,Forex Dollar gains vs yen in Asia BoJ Aussie jobs eyed,bull,aud/jpy
860,396,2017-03-15,Forex USD/CAD trims losses but remains under pressure,bear,usd/cad
861,396,2017-03-15,Forex Aussie kiwi move higher vs. greenback ahead of Fed decision,bull,aud/nzd
862,398,2017-03-10,Forex GBP/USD edges higher after mixed U.K. data,bull,gbp/usd
863,399,2017-03-09,Forex Aussie kiwi move lower vs. stronger greenback,bear,aud/nzd
864,399,2017-03-08,Forex Canadian dollar hits two-month lows after US ADP data,bear,usd/cad
865,400,2017-03-08,Forex Aussie little changed kiwi moves higher in late trade,bull,aud/nzd
866,402,2017-03-03,Forex USD/CAD pares gains pulls away from 2-month peak,bull,usd/cad
867,402,2017-03-03,Forex GBP/USD hits fresh 6-week lows as U.K. data disappoints,bear,gbp/usd
868,403,2017-03-02,Forex Aussie kiwi lower vs. greenback after mixed Australian data,bear,aud/nzd
869,404,2017-03-01,Forex Aussie kiwi move lower vs. broadly stronger greenback,bear,aud/nzd
870,405,2017-02-26,Forex Pound weaker in Asia on Brexit Scotland views Aussie up,bear,gbp/aud
871,406,2017-02-23,Forex USD/CAD drops on U.S. data climbing oil prices,bear,usd/cad
872,406,2017-02-22,Forex USD/CAD at 2-week highs after weak Canadian data,bear,usd/cad
873,407,2017-02-22,Forex Aussie edges higher kiwi steady ahead of Fed minutes,bull,aud/nzd
874,408,2017-02-17,Dollar gets its groove back pound and euro take a tumble,bear,eur/gbp
875,408,2017-02-17,Forex USD/CAD edges higher in early trade,bull,usd/cad
876,408,2017-02-17,Forex GBP/USD drops on downbeat U.K. retail sales,bear,gbp/usd
877,409,2017-02-16,Forex Aussie kiwi edge lower vs. stronger greenback,bear,aud/nzd
878,409,2017-02-15,Forex USD/CAD rises on U.S. optimism rate hike hopes,bull,usd/cad
879,411,2017-02-10,Forex GBP/USD edges higher on upbeat U.K. data,bull,gbp/usd
880,412,2017-02-09,Forex U.S. dollar pops higher against yen on Trump comments,bull,usd/jpy
881,412,2017-02-09,Forex USD/CAD slips lower as oil prices jump,bear,usd/cad
882,412,2017-02-09,Forex Aussie kiwi move lower after RBNZ holds NAB report,bear,aud/nzd
883,412,2017-02-08,Forex USD/CAD falls but losses seen limited,bear,usd/cad
884,412,2017-02-08,Political risks weigh on euro yen gains,bull,eur/jpy
885,413,2017-02-08,Forex Aussie little changed kiwi slips lower in late trade,bear,aud/nzd
886,413,2017-02-06,Euro falters on political uncertainty dollar slides vs. yen,bear,eur/jpy
887,414,2017-02-03,CFTC Speculators Less Bearish on Euro Yen Crude Oil Net Longs at All-Time High,bull,eur/jpy
888,414,2017-02-03,Forex USD/CAD pares gains after U.S. employment data,bull,usd/cad
889,415,2017-02-03,Forex GBP/USD falls after U.K. services PMI disappoints,bear,gbp/usd
890,416,2017-02-02,Forex Aussie kiwi higher vs. greenback after data Fed,bull,aud/nzd
891,416,2017-02-01,Forex USD/CAD trims gains ahead of FOMC decision,bull,usd/cad
892,416,2017-02-01,Forex Aussie kiwi move lower as greenback recovers,bear,aud/nzd
893,417,2017-01-30,Forex Euro weakens Trump travel ban fears underpin yen,bear,eur/jpy
894,418,2017-01-27,CFTC Speculators Less Bearish on Euro Yen Crude Oil Net Longs at All-Time High,bull,eur/jpy
895,418,2017-01-27,Forex USD/CAD trims gains after U.S. data,bull,usd/cad
896,419,2017-01-26,Forex Aussie kiwi slide lower but downside limited,bear,aud/nzd
897,420,2017-01-25,Forex Aussie kiwi move lower vs. mildly stronger greenback,bear,aud/nzd
898,421,2017-01-20,Forex USD/CAD pares gains but remains supported after Canadian data,bull,usd/cad
899,421,2017-01-20,Forex GBP/USD turns lower on weak U.K. retail sales data,bear,gbp/usd
900,422,2017-01-19,Forex USD/CAD trims gains but remains stronger on U.S. data,bull,usd/cad
901,422,2017-01-19,Forex Aussie kiwi move higher vs. greenback in late trade,bull,aud/nzd
902,423,2017-01-18,Forex USD/CAD trims gains after BoC holds,bull,usd/cad
903,423,2017-01-18,Forex Aussie kiwi slide as greenback recovers from Trump remarks,bear,aud/nzd
904,424,2017-01-16,Forex Brexit fears pummel pound safe haven yen climbs,bear,gbp/jpy
905,424,2017-01-16,Forex Sterling slumps on hard Brexit fears safe haven yen rises,bear,gbp/jpy
906,425,2017-01-13,Forex USD/CAD almost unchanged off three-month lows,bear,usd/cad
907,427,2017-01-11,Forex USD/CAD edges higher ahead of Trump remarks,bull,usd/cad
908,427,2017-01-11,Forex Aussie kiwi move higher vs. greenback ahead of Trump speech,bull,aud/nzd
909,429,2017-01-06,Sterling to slip a little further after EU divorce process starts Reuters poll,bear,eur/gbp
910,431,2017-01-03,Forex Yen Aussie gain in Asia in rebound from sharp dollar index rise,bull,aud/jpy
911,433,2016-12-29,Dollar falls against yen on U.S. yield drop profit-taking,bear,usd/jpy
912,433,2016-12-29,Dollar rally loses steam ahead of New Year's drops against yen euro ,bear,eur/jpy
913,433,2016-12-27,Dollar gains against yen on U.S. data Fed expectations,bull,usd/jpy
914,434,2016-12-25,Dollar dips vs. yen after U.S. yields pull away from highs,bear,usd/jpy
915,434,2016-12-23,Forex USD/CAD hits 5-week highs after weak Canadian GDP data,bear,usd/cad
916,435,2016-12-22,Forex USD/CAD rises to 3-1/2 week highs after U.S. Canadian data,bull,usd/cad
917,435,2016-12-22,Forex Kiwi moves higher on upbeat GDP Aussie holds steady,bull,aud/nzd
918,435,2016-12-21,Forex USD/CAD edges higher in subdued trade,bull,usd/cad
919,435,2016-12-21,Forex Aussie holds steady kiwi moves higher in late trade,bull,aud/nzd
920,436,2016-12-16,CFTC Speculators Less Bearish on Euro More Bearish on Yen Crude Oil Net Longs at 2-Year High,bull,eur/jpy
921,437,2016-12-16,Forex USD/CAD rises hovers close to 2-week highs,bull,usd/cad
922,437,2016-12-15,Dollar index hits 103 after Fed hike at 118 yen euro touches 2003 low   ,bear,eur/jpy
923,438,2016-12-15,Forex Aussie holds steady kiwi moves lower after Fed rate hike,bear,aud/nzd
924,438,2016-12-14,Forex Aussie rebounds in Asia on jobs data yen holds weaker after Fed,bear,aud/jpy
925,438,2016-12-14,Forex Dollar posts sharp gains in Asia vs yen Aussie after Fed hike,bull,aud/jpy
926,438,2016-12-14,Forex USD/CAD falls to fresh 2-month lows with Fed on tap,bear,usd/cad
927,438,2016-12-14,Forex Aussie holds steady kiwi moves higher ahead of Fed,bull,aud/nzd
928,440,2016-12-09,Forex USD/CAD falls to 8-week lows amid sharply higher oil prices,bear,usd/cad
929,441,2016-12-08,Forex Aussie holds steady kiwi moves higher vs. greenback,bull,aud/nzd
930,441,2016-12-07,Forex Yen a tad weaker ahead of GDP figures China Aussie trade,bear,aud/jpy
931,441,2016-12-07,Forex USD/CAD edges lower after BoC holds ,bear,usd/cad
932,441,2016-12-07,Forex Aussie slides lower on weak GDP kiwi holds steady,bear,aud/nzd
933,442,2016-12-05,Euro yen close higher,bull,eur/jpy
934,443,2016-12-02,Forex USD/CAD at 2-month lows after U.S. Canadian data,bear,usd/cad
935,443,2016-12-02,Forex GBP/USD edges higher on upbeat U.K. construction data,bull,gbp/usd
936,443,2016-12-01,Forex USD/CAD slides lower on U.S. data climbing oil prices,bear,usd/cad
937,444,2016-12-01,Forex Aussie kiwi move higher on oil surge China PMI,bull,aud/nzd
938,444,2016-11-30,Forex USD/CAD eases off 3-week lows remains under pressure,bear,usd/cad
939,444,2016-11-30,Forex Aussie holds steady kiwi moves higher in late trade,bull,aud/nzd
940,444,2016-11-29,Forex Aussie edges down after housing data kiwi retraces gains,bull,aud/nzd
941,444,2016-11-29,Forex USD/CAD moves higher after U.S. Canadian data,bull,usd/cad
942,445,2016-11-29,Forex Aussie slips lower kiwi edges higher in cautious trade,bear,aud/nzd
943,445,2016-11-28,Sterling dips on euro bounce focus on Draghi hearing,bear,eur/gbp
944,445,2016-11-28,Forex Aussie kiwi move higher vs. greenback amid profit-taking,bull,aud/nzd
945,446,2016-11-24,Forex Aussie kiwi edge lower vs. broadly stronger greenback,bear,aud/nzd
946,447,2016-11-23,Forex Aussie kiwi move higher as greenback pauses,bull,aud/nzd
947,447,2016-11-22,Forex USD/CAD remains lower despite tepid Canadian data,bear,usd/cad
948,447,2016-11-21,Forex USD/CAD slides lower as oil prices rally,bear,usd/cad
949,449,2016-11-17,Forex USD/CAD pares losses strong U.S. data supports,bull,usd/cad
950,449,2016-11-17,Forex Aussie slips lower after jobs data kiwi moves higher,bear,aud/nzd
951,450,2016-11-16,Forex Aussie slips lower kiwi holds steady vs. stronger greenback,bear,aud/nzd
952,451,2016-11-15,Forex Aussie kiwi edge higher vs. greenback gains limited,bull,aud/nzd
953,451,2016-11-14,Forex Aussie little changed kiwi lower vs. stronger greenback,bear,aud/nzd
954,452,2016-11-10,Forex Yen gains in Asia as investors move past U.S. politics,bull,usd/jpy
955,453,2016-11-10,Forex USD/CAD hovers near 7-month peak amid declining oil prices,bear,usd/cad
956,453,2016-11-10,Forex Kiwi slips lower after RBNZ cuts rates Aussie gains ground,bear,aud/nzd
957,455,2016-11-07,Forex USD/CAD slips lower on oil rebound,bear,usd/cad
958,456,2016-11-06,Forex Aussie down after AI data dollar gains on U.S. politics,bull,aud/usd
959,456,2016-11-04,Forex USD/CAD rises to 8-month highs after U.S. Canadian data,bull,usd/cad
960,457,2016-11-03,Forex Aussie gains after RBA forecasts retail sales U.S. jobs eyed,bull,aud/usd
961,458,2016-11-02,Dollar slumps yen and franc surge as Trump rattles markets,bear,chf/jpy
962,458,2016-11-02,Forex Aussie slides lower kiwi gains ground after data,bear,aud/nzd
963,459,2016-11-01,Forex Aussie and kiwi move higher after RBA decision Chinese data,bull,aud/nzd
964,459,2016-11-01,Sterling to fall to $1.15 after EU divorce proceedings begin  Reuters poll,bear,eur/gbp
965,460,2016-10-31,Forex Aussie holds steady kiwi moves lower vs. greenback,bear,aud/nzd
966,460,2016-10-28,Dollar rises to three-month high vs. yen before pivotal U.S. GDP data,bull,usd/jpy
967,462,2016-10-25,Forex Aussie gains solidly after CPI data above expectations yen down,bull,aud/jpy
968,462,2016-10-25,Forex Yen Aussie gain in Asia as prices data eyed,bull,aud/jpy
969,462,2016-10-24,Forex Yen Aussie weaker in Asia as Fed rate hike views firm,bear,aud/jpy
970,463,2016-10-24,Forex USD/CAD trims gains after Canadian data remains supported,bull,usd/cad
971,463,2016-10-24,Forex EUR/USD steady near 7-month lows despite upbeat E.Z. data,bear,eur/usd
972,463,2016-10-23,Forex Yen weaker ahead of trade data U.S. election in focus,bear,usd/jpy
973,463,2016-10-21,CFTC Speculators More Bullish on U.S. Dollar Euro Net Shorts at 3-Month High,bull,eur/usd
974,463,2016-10-21,Forex GBP/USD edges lower after downbeat U.K. data,bear,gbp/usd
975,464,2016-10-20,Forex USD/CAD moves higher in early trade,bull,usd/cad
976,464,2016-10-20,Forex Aussie moves lower after mixed data kiwi holds steady,bear,aud/nzd
977,464,2016-10-19,Forex Aussie holds weaker after jobs fireworks from U.S. debate noted,bear,aud/usd
978,465,2016-10-19,Forex USD/CAD pushes lower after BoC holds,bear,usd/cad
979,465,2016-10-19,Forex Aussie holds steady kiwi moves higher in late trade,bull,aud/nzd
980,465,2016-10-18,Forex USD/CAD slides lower after U.S. Canadian data,bear,usd/cad
981,465,2016-10-18,Forex Kiwi Aussie move higher after N.Z. data RBA remarks,bull,aud/nzd
982,466,2016-10-17,Forex USD/CAD erases gains after U.S. data disappoints,bull,usd/cad
983,466,2016-10-14,Forex USD/CAD loses some groud but downside seen limited,bear,usd/cad
984,467,2016-10-13,Forex Yen turns slightly weaker Aussie rebounds ahead of China prices,bear,aud/jpy
985,467,2016-10-13,Forex Yen gains in early Asia Aussie down a tad ahead of China prices,bull,aud/jpy
986,467,2016-10-13,Forex USD/CAD turns lower but downside seen limited,bear,usd/cad
987,467,2016-10-13,Dollar up on Fed minutes yen Swiss franc gain as risk-off holds   ,bull,chf/jpy
988,467,2016-10-13,Forex Aussie kiwi lower after Chinese trade data Fed minutes,bear,aud/nzd
989,468,2016-10-11,Forex USD/CAD trims gains but remains supported,bull,usd/cad
990,468,2016-10-11,Forex Aussie kiwi decline against stronger greenback,bear,aud/nzd
991,468,2016-10-10,Forex Dollar gains smartly in Asia against yen Aussie as Fed in focus,bull,aud/jpy
992,469,2016-10-10,Forex USD/CAD slides lower amid rising oil prices,bear,usd/cad
993,469,2016-10-10,Forex Aussie almost unchanged kiwi lower vs. greenback,bear,aud/nzd
994,469,2016-10-09,Forex Aussie retraces early gains in Asia U.S. debate shrugged off,bull,aud/usd
995,469,2016-10-09,Forex Aussie gains in Asia as U.S. debate policy views and data noted,bull,aud/usd
996,470,2016-10-07,Flash crash' thrashes sterling dollar slides on U.S. jobs data,bear,gbp/usd
997,470,2016-10-07,Forex GBP/USD at fresh 31-year lows after downbeat U.K. data,bear,gbp/usd
998,470,2016-10-06,Forex Yen gains as British pound drops sharply in Asia on Brexit fears,bear,gbp/jpy
999,470,2016-10-06,Australia New Zealand dollar forecasts turn less bearish as yield appeal grows,bull,aud/nzd
1000,470,2016-10-06,Forex Aussie weaker despite AIG construction survey U.S. jobs eyed,bear,aud/usd
1001,470,2016-10-06,Forex USD/CAD moves higher after U.S. Canadian data,bull,usd/cad
1002,471,2016-10-06,Forex Aussie kiwi move lower against stronger greenback,bear,aud/nzd
1003,471,2016-10-05,Euro makes broad gains rises to five-year high against sterling,bull,eur/gbp
1004,471,2016-10-04,Forex GBP/USD hits 31-year lows despite U.K. data,bear,gbp/usd
1005,472,2016-10-03,Sterling drops near 31-year low dollar firms on U.S. data,bear,gbp/usd
1006,472,2016-10-03,Forex USD/CAD trims losses but rising oil prices weigh,bull,usd/cad
1007,472,2016-10-03,Forex GBP/USD drops to 3-month lows despite U.K. data,bear,gbp/usd
1008,473,2016-09-30,Forex GBP/USD edges higher after upbeat U.K. data,bull,gbp/usd
1009,473,2016-09-30,Euro hits two-month low vs Swiss franc on Deutsche Bank jitters,bear,eur/chf
1010,474,2016-09-29,Forex GBP/USD edges lower despite upbeat U.K. data,bear,gbp/usd
1011,474,2016-09-28,Forex USD/CAD edges higher on OPEC meeting anticipation,bull,usd/cad
1012,475,2016-09-27,Forex USD/CAD hits fresh 6-month highs amid tumbling oil prices,bear,usd/cad
1013,475,2016-09-27,Forex Aussie kiwi move higher vs. greenback in late trade,bull,aud/nzd
1014,475,2016-09-26,Forex Yen gains on BoJ July minutes easing push U.S. debate eyed ,bull,usd/jpy
1015,475,2016-09-26,Forex Yen a tad weaker ahead of BoJ minutes U.S. debates eyed,bear,usd/jpy
1016,475,2016-09-26,Forex USD/CAD trims gains as oil prices jump,bull,usd/cad
1017,477,2016-09-22,Forex Kiwi steady after RBNZ holds Aussie rises on Fed statement,bull,aud/nzd
1018,477,2016-09-21,Forex GBP/USD hits fresh 1-month lows despite U.K. data,bear,gbp/usd
1019,477,2016-09-21,Forex Aussie kiwi move lower before central bank statements,bear,aud/nzd
1020,478,2016-09-20,Forex Aussie kiwi move higher with Fed meeting in focus,bull,aud/nzd
1021,479,2016-09-16,Forex USD/CAD rises to 8-week highs after U.S. Canadian data,bull,usd/cad
1022,480,2016-09-13,Forex USD/CAD near 1-month highs on tumbling oil prices,bear,usd/cad
1023,481,2016-09-13,Forex GBP/USD edges lower after U.K. inflation data,bear,gbp/usd
1024,481,2016-09-13,Forex Aussie kiwi move lower despite Brainard remarks,bear,aud/nzd
1025,481,2016-09-12,Forex USD/CAD hits more than 1-week highs on dropping oil prices,bear,usd/cad
1026,482,2016-09-08,Forex Aussie yen gain in early Asia with focus on China CPI,bull,aud/jpy
1027,483,2016-09-07,Forex  Yen Aussie gain as China trade regional data supports,bull,aud/jpy
1028,483,2016-09-07,Forex GBP/USD slides lower after U.K. data disappoints,bear,gbp/usd
1029,484,2016-09-06,Forex USD/CAD pares losses as oil prices turn lower,bear,usd/cad
1030,484,2016-09-06,Forex Aussie and kiwi move higher RBA holds rates,bull,aud/nzd
1031,484,2016-09-05,Forex USD/CAD pares losses but remains under pressure,bear,usd/cad
1032,485,2016-09-05,Forex GBP/USD rises to 1-month highs on strong U.K. data,bull,gbp/usd
1033,485,2016-09-04,Forex Aussie holds gains in Asia yen up after BoJ chief speaks,bull,aud/jpy
1034,485,2016-09-04,Forex Aussie rebounds in Asia yen gains as Japan wages data noted,bull,aud/jpy
1035,485,2016-09-02,Forex USD/CAD drops after U.S. Canadian economic reports,bear,usd/cad
1036,486,2016-09-02,Forex Yen weaker as eyes turn to U.S. jobs G-20 summit,bear,usd/jpy
1037,486,2016-09-01,Forex GBP/USD climbs near 1-month highs on strong U.K. data,bull,gbp/usd
1038,486,2016-09-01,Forex Aussie kiwi edge higher vs. greenback on China PMI,bull,aud/nzd
1039,487,2016-08-30,Forex GBP/USD slips lower after downbeat U.K. data,bear,gbp/usd
1040,488,2016-08-30,Forex Aussie kiwi slip lower vs. broadly stronger greenback,bear,aud/nzd
1041,488,2016-08-29,Dollar hits 3-week high vs yen as U.S. rate rise signals get louder,bull,usd/jpy
1042,488,2016-08-29,Forex Aussie falls to 4-month lows kiwi holds steady vs. greenback,bear,aud/nzd
1043,490,2016-08-25,Forex Aussie kiwi move higher ahead of Yellen speech,bull,aud/nzd
1044,490,2016-08-24,Forex Aussie kiwi fall vs. greenback after downbeat data,bear,aud/nzd
1045,491,2016-08-23,Forex EUR/USD trims gains after E.Z. PMI reports,bull,eur/usd
1046,491,2016-08-23,Forex Aussie kiwi move higher after Wheeler comments,bull,aud/nzd
1047,491,2016-08-22,Forex USD/CAD trims gains after upbeat Canadian data,bull,usd/cad
1048,491,2016-08-22,Forex Aussie and kiwi move lower vs. stronger greenback,bear,aud/nzd
1049,491,2016-08-21,Forex Yen Aussie fall further in Asia as Fischer views drive dollar,bear,aud/jpy
1050,492,2016-08-19,Forex GBP/USD slides lower despite positive U.K. data,bear,gbp/usd
1051,493,2016-08-18,Forex GBP/USD rises to more than 2-week highs on U.K. data,bull,gbp/usd
1052,493,2016-08-18,Forex Aussie kiwi gain ground after Australian data Fed minutes,bull,aud/nzd
1053,493,2016-08-17,Forex Jump in jobs growth sends Aussie higher  yen gains on dollar ,bull,aud/jpy
1054,493,2016-08-17,Forex Yen gains ahead of trade figures Australia jobs data due ,bull,aud/jpy
1055,493,2016-08-17,Forex USD/CAD trims gains ahead of Fed meeting minutes,bull,usd/cad
1056,493,2016-08-17,Forex GBP/USD slips lower despite U.K. data,bear,gbp/usd
1057,493,2016-08-17,Forex Aussie kiwi move lower despite upbeat economic reports,bear,aud/nzd
1058,494,2016-08-16,U.S. Dollar Index falls to 2-month low amid soft inflation strong Pound,bear,gbp/usd
1059,494,2016-08-16,Forex USD/CAD eases off 1-1/2 month lows but U.S. data weighs,bear,usd/cad
1060,494,2016-08-16,Forex GBP/USD bounces off 1-month lows on U.K. inflation report,bear,gbp/usd
1061,494,2016-08-16,Forex Aussie and kiwi move higher after RBA meeting minutes,bull,aud/nzd
1062,495,2016-08-15,Forex USD/CAD hits fresh 1-month lows after Empire State report,bear,usd/cad
1063,495,2016-08-12,Forex USD/CAD drops on weak U.S. retail sales PPI data,bear,usd/cad
1064,495,2016-08-12,Forex EUR/USD edges higher after positive E.Z. data,bull,eur/usd
1065,495,2016-08-11,Forex Aussie falls as China data disappoints Kiwi down on RBNZ delay,bear,aud/nzd
1066,496,2016-08-11,Forex Aussie falls as China data disappoints Kiwi down on RBNZ delay,bear,aud/nzd
1067,496,2016-08-11,Forex USD/CAD slips lower after U.S. Canadian data,bear,usd/cad
1068,497,2016-08-10,Forex Aussie and kiwi gain ground eyes on RBNZ meeting,bull,aud/nzd
1069,497,2016-08-09,Forex Aussie yen hold gains in Asia on machinery orders sentiment,bull,aud/jpy
1070,497,2016-08-09,Forex Yen Aussie weaker ahead of machinery orders housing data,bear,aud/jpy
1071,497,2016-08-09,GBP/USD falls to near 1-month lows as BOE launches bond buying program,bear,gbp/usd
1072,497,2016-08-09,Forex USD/CAD trims gains as oil prices bounce back,bull,usd/cad
1073,497,2016-08-09,Forex GBP/USD falls to fresh 1-month lows on U.K. data,bear,gbp/usd
1074,497,2016-08-09,Forex Aussie kiwi move lower vs. broadly stronger greenback,bear,aud/nzd
1075,497,2016-08-08,EUR/USD fall slightly as investors continue to stake bets on Fed hike,bear,eur/usd
1076,498,2016-08-08,EUR/USD fall slightly as investors continue to stake bets on Fed hike,bear,eur/usd
1077,498,2016-08-08,Forex USD/CAD slips lower amid rising oil prices,bear,usd/cad
1078,498,2016-08-08,ForexDollar builds on gains vs. yen after upbeat U.S. jobs report,bull,usd/jpy
1079,498,2016-08-08,Forex Aussie holds steady kiwi slides lower vs. greenback,bear,aud/nzd
1080,498,2016-08-07,Forex Aussie yen weaker after regional trade figures disappoint,bear,aud/jpy
1081,498,2016-08-05,GBP/USD falls to 3-week lows as solid jobs data triggers Dollar rally,bear,gbp/usd
1082,499,2016-08-04,GBP/USD plunges after BOE rate cut as U.K. Gilts fall to new record low,bear,gbp/usd
1083,499,2016-08-04,Forex GBP/USD slips lower ahead of BoE decision,bear,gbp/usd
1084,499,2016-08-04,Forex Aussie edges higher kiwi holds steady vs. greenback,bull,aud/nzd
1085,499,2016-08-03,GBP/USD falls slightly as investors brace for likely BOE rate cut,bear,gbp/usd
1086,500,2016-08-03,GBP/USD falls slightly as investors brace for likely BOE rate cut,bear,gbp/usd
1087,500,2016-08-03,Forex USD/CAD pares losses after strong U.S. data,bull,usd/cad
1088,500,2016-08-03,Forex GBP/USD slips lower after U.K. data eyes on BoE meeting,bear,gbp/usd
1089,500,2016-08-03,Forex Aussie and kiwi move lower in late trade,bear,aud/nzd
1090,500,2016-08-02,USD/JPY falls sharply testing 100 level as Abe cabinet approves stimulus,bear,usd/jpy
1091,500,2016-08-02,Forex USD/CAD moves lower in early trade,bear,usd/cad
1092,501,2016-08-02,Forex Aussie holds steady after RBA rate cut kiwi moves higher,bull,aud/nzd
1093,501,2016-08-01,Forex USD/CAD gains ground in thin trade,bull,usd/cad
